{"execution":{"completed_at_utc":"2026-09-19T10:37:13.097088Z","exit_code":0,"started_at_utc":"2026-09-19T10:37:12.158137Z","structured_diagnostics":{"config":{"bytes":78,"path":"kb_creator/inputs/number-7-dream/publication/v4/configs/master_ru.json","sha256":"C72AB02C24A7B079AE1C0B858D6015F6F3CC324A8391971289708BC90FD03FA6"},"status":"awaiting_master_ru_submission"}},"reproducible":{"adapter":{"logical_name":"master_ru_packets_v1","script":{"bytes":129961,"path":"publication_adapters.py","sha256":"C591607EE90943FD8ACAB002A534555740DE9A1ACE888D82720515BB97232144"},"version":1},"cache_key":"BFEA1D9E331EC097B8ED12F917F6D46DEF91FC8B9D59F8711BAB415D9C7A507E","effective_config":{"bytes":3444,"path":"effective_publication_config.json","sha256":"38E8DE98D20C80A4C30F9EDB2F1C2D86D52E2B0F248B906732107E3BF58621ED"},"evidence":{"files":[{"bytes":16003,"path":"terminology/authority-00.csv","sha256":"EE84E121E63ECDA3F2165205E8335FD3C68E70CF1DEFE1D00CE6C3FF97EFF3AE"}],"inventory_sha256":"104EEAA97B6B5F0A8343B842A6175CECC7DAAD32A2AFB15AB0DB2114095BBBB4","root":"outputs/20-master-ru-packets/evidence"},"implementation_inventory_sha256":"AA92C8235C6BF8E8A54B6C943A861CC6EDD3CD0F3D83AF0D8B8751E481220148","inputs":[{"file":{"bytes":5011,"path":"number-7-dream.publication-v11.json","sha256":"A9DCB11CBEDC830063C65E275FCD82761AD03F9D5AFB233C0140600465B6FB37"},"kind":"publication_contract"},{"file":{"bytes":1845,"path":"RECONSTRUCTION_ACCEPTANCE.json","sha256":"E4FF9ED8D3ACC98225FCA973ACA8A90A1B1E53990DA2F8426E2852176A6F184D"},"kind":"accepted_reconstruction"},{"file":{"bytes":1125,"path":"acceptance/master_en.acceptance.json","sha256":"25E06455028496C4FD6F85FBB796DCF2739F572222452CE7087200DA652381A3"},"kind":"master_en_acceptance"}],"outputs":{"files":[{"bytes":8289,"path":"batches/batch-0001.en.json","sha256":"F142CA20DAC0DD5BBA771EA3E8CDB2E8FDEB18F7D5CF97956D2361CB54A8C6D2"},{"bytes":6040,"path":"batches/batch-0002.en.json","sha256":"A626B2E0305F5FE84FBEE06371B202CC86B9BBB11A7A5C3B4264E97A3AE48625"},{"bytes":6699,"path":"batches/batch-0003.en.json","sha256":"BED631D5A2ADB558818BC209EF33ABB254054C3A61F5EB180419F90B7572BDE4"},{"bytes":5926,"path":"batches/batch-0004.en.json","sha256":"00AFE7F718818038947A680C765E802D122B55008E9A150EA27A919C026094E8"},{"bytes":5392,"path":"batches/batch-0005.en.json","sha256":"FDBC73B770FF6159F43CA486FFB6E4C11CA01EFF932CD3BAF3DF988E540E0884"},{"bytes":5970,"path":"batches/batch-0006.en.json","sha256":"29BB47FA2E5108F916B9E901CE3EC3F6C94D3AFA1AA28D865E6926197EBD794F"},{"bytes":7227,"path":"batches/batch-0007.en.json","sha256":"68F316D154622018BC125F158F5D5CB4FE92E10998B9B4B016F1B3361D012078"},{"bytes":7324,"path":"batches/batch-0008.en.json","sha256":"3960EE8C5B8ED1B8F587194CA02B5764CF96FAB5536D37533AB7B49FEDB8CD87"},{"bytes":6367,"path":"batches/batch-0009.en.json","sha256":"9B2584E02FCB3779D2AD097BA71D82602804360AEE9D642924A68B18B14E61AF"},{"bytes":6329,"path":"batches/batch-0010.en.json","sha256":"5EB4C471A4ACFE7DEF21D90847450F4435E02BEF29C797A4C276C2C2AB8A447A"},{"bytes":5246,"path":"batches/batch-0011.en.json","sha256":"62C7364F59EE27B024E6AEF404B34316871F980678AE9E83621F57304D59D9C8"},{"bytes":7098,"path":"batches/batch-0012.en.json","sha256":"0D5C48AA15580278413E7AEE92714FE8677E62C2F8A92D25B4A52E833BC438A0"},{"bytes":5776,"path":"batches/batch-0013.en.json","sha256":"6F388A2C0F96CCF3B3F00A98468365863A6F4C9165FEAD68611837F0BA7A14E0"},{"bytes":5202,"path":"batches/batch-0014.en.json","sha256":"39E06E227026ACDEFBA6C25DB5763515019462C0EBA4704EAA946EC303006419"},{"bytes":6236,"path":"batches/batch-0015.en.json","sha256":"4B032EC7C19E4F61980825D47DE896D160FDB3CC4D5E761B44FC33F3325085EF"},{"bytes":4140,"path":"batches/batch-0016.en.json","sha256":"0674E4C3F303AF1FF0BC00FA7BC32A53EEE39CEDD7121D3EC8A9DFDCEF84964B"},{"bytes":4648,"path":"batches/batch-0017.en.json","sha256":"4EF147903F81B069DCAF9C3DF658873BF1CCAEE39482E9B8293EE3CF615ECD9E"},{"bytes":7498,"path":"batches/batch-0018.en.json","sha256":"7ACC1AB65E846C14067B4651C336E94D7E144843E9A95596B206FB6C49FF8FB5"},{"bytes":7173,"path":"batches/batch-0019.en.json","sha256":"2FD2B9C04EA53C1BDA9FDC43BE2F29622ACDDE1510048AE84A9848C597DD639E"},{"bytes":7340,"path":"batches/batch-0020.en.json","sha256":"C980AFDF49F3F9748DBEC4B930CFF9965086236994987259988713C13A8F9485"},{"bytes":7673,"path":"batches/batch-0021.en.json","sha256":"360A7457E6A18473FA1053A6494E7E680BDED58E32AD2C0B4AA437B0D46E2C26"},{"bytes":6627,"path":"batches/batch-0022.en.json","sha256":"48C6DF8E607CBE9AA4194CB603797126DFC61C5DE6162AD32CEAB3BDAA6CECA9"},{"bytes":5550,"path":"batches/batch-0023.en.json","sha256":"3EA0F5BA533711738B5BA97A3BC48E21739841DFC184D591A88E8AD8F0317BE6"},{"bytes":7857,"path":"batches/batch-0024.en.json","sha256":"5542D169B2B4E674B1AC26FAFD4E821289BD942D20DDFE1ABB6CE924E7911451"},{"bytes":8313,"path":"batches/batch-0025.en.json","sha256":"EEAAAE6CC0A1F30988A50EAA1740E9F67ABEF2AA2248E2945FE222135E71371A"},{"bytes":8105,"path":"batches/batch-0026.en.json","sha256":"FF66B045E6A1F3106E008F1E3B5F6AC9242F1FC59AF4FD4E7EEC99299D5FE1AF"},{"bytes":5967,"path":"batches/batch-0027.en.json","sha256":"3FFB47459C9030DD4C67A3D78A66A92FAFB5AC481DCA5D1B68437EDE9F10A4FC"},{"bytes":10723,"path":"packet_manifest.json","sha256":"1007FFB8C63807D24528714A2BD5A2CB4B336987AC8C6076C9AF45ED0F928390"},{"bytes":128037,"path":"translation_tasks.json","sha256":"8A9C162DFF11179DDCDE7CFDB99B7DECC6EA7F5BE53EE014D37492981C44EBD0"}],"inventory_sha256":"E879E6360E7D80C418AEC9BAFF80C4B396FDE010D9EA105569BA52FE186EA738","root":"outputs/20-master-ru-packets/artifacts"},"run_identity_sha256":"BB42B89B11E13357F865B4582A5C53AC8F5A3458C3E128F2D16BC39D4E3C25F6","stage_id":"20-master-ru-packets","stage_name":"master_ru_packets","stage_version":1,"state":"succeeded","tools":[{"name":"publication_python","scope":"repository_tools","version":"sha256:7958A78EDB29E1BC8B6BB7C1F71271AD824A64F67278903ADA4885104A22A001"},{"name":"pdftoppm","scope":"repository_tools","version":"sha256:575A2F66073B256F69084C4F12F34427E6076B7854B2505CB09ECBDC9957FD7F"},{"name":"libreoffice","scope":"repository_tools","version":"sha256:A2823391857DB1DD8EBBD8234267F9EC58EC7E5B5FC434665C0ECEC4671CB988"}],"upstream":[{"manifest_sha256":"0D4FDF06C69E364C599E7AB7302AFBF632379D10669C7F1135BDAE2F0B15ADFE","stage_id":"10-master-en-candidate"}]},"reproducible_sha256":"68AF1DF65460AE42B9CF888394B53D32676D33A6D94596E71AE34BFEF0C263F1","schema":"kb_creator.publication_stage_manifest.v1"}
