{"execution":{"completed_at_utc":"2026-09-19T10:39:46.254311Z","exit_code":0,"started_at_utc":"2026-09-19T10:39:44.670679Z","structured_diagnostics":{"candidate_manifest":{"bytes":45740,"path":"outputs/30-artview-bundle/artifacts/candidate_manifest.json","sha256":"A1045CBD368B57D4766F1E978E0315E78D33F37859119369AA0B69909BAD04C1"},"status":"ready_for_html_candidate"}},"reproducible":{"adapter":{"logical_name":"scenario_artview_apply_v1","script":{"bytes":129961,"path":"publication_adapters.py","sha256":"C591607EE90943FD8ACAB002A534555740DE9A1ACE888D82720515BB97232144"},"version":1},"cache_key":"9BE969B681BA058F6989B3109A894CD1C08F2C127F28C7A02C139D7F722D3DF4","effective_config":{"bytes":3444,"path":"effective_publication_config.json","sha256":"38E8DE98D20C80A4C30F9EDB2F1C2D86D52E2B0F248B906732107E3BF58621ED"},"evidence":{"files":[],"inventory_sha256":"4F53CDA18C2BAA0C0354BB5F9A3ECBE5ED12AB4D8E11BA873C2F11161202B945","root":"outputs/31-artview-apply/evidence"},"implementation_inventory_sha256":"AA92C8235C6BF8E8A54B6C943A861CC6EDD3CD0F3D83AF0D8B8751E481220148","inputs":[{"file":{"bytes":5011,"path":"number-7-dream.publication-v11.json","sha256":"A9DCB11CBEDC830063C65E275FCD82761AD03F9D5AFB233C0140600465B6FB37"},"kind":"publication_contract"},{"file":{"bytes":1845,"path":"RECONSTRUCTION_ACCEPTANCE.json","sha256":"E4FF9ED8D3ACC98225FCA973ACA8A90A1B1E53990DA2F8426E2852176A6F184D"},"kind":"accepted_reconstruction"},{"file":{"bytes":1090,"path":"acceptance/artview.acceptance.json","sha256":"E91C1F24F8802135BEC425FEB30AB8D8CF778AE82307A59EEEF62B7F6D22B292"},"kind":"artview_acceptance"},{"file":{"bytes":8304,"path":"submissions/artview/artview-decisions.accepted.json","sha256":"BD4EED5B94854FB8909512F1955ECE822CB5F523B990DEF107B90A2BBEF38933"},"kind":"artview_decisions"}],"outputs":{"files":[{"bytes":5284,"path":"ARTVIEW_APPLIED.json","sha256":"CA1B53C4298A9629E1E21D239A5B63073EFE6379FA57C23EAC5AA8A74A31A05C"},{"bytes":179661,"path":"assets/master-page-020-asset-001.jpg","sha256":"7D73DFEA3BAA03B388A63F836C0CA43F9238EFEE255AB26FFCDB49BFACF79890"},{"bytes":49023,"path":"assets/page-004-xref-80-gen-0-resource-image100.jpg","sha256":"55CA597755B7DF71C1E3699353265EE4AD9771EBBDB920410317E7073F6284FE"},{"bytes":49082,"path":"assets/page-005-xref-80-gen-0-resource-image100.jpg","sha256":"8FC42816BF72BEDA6938FAAD5A1AFF6DEA6DE1BEF286EE8D8822A8DAC55BBBD6"},{"bytes":31076,"path":"assets/page-006-xref-15-gen-0-resource-image110.jpg","sha256":"D546EF251ACE98DF9136EA8C332883B06594C7082D32ED1AC80C4DBD915D9523"},{"bytes":30984,"path":"assets/page-007-xref-19-gen-0-resource-image112.jpg","sha256":"FFD474F4A049B1968C6F7B5F9068019B5CDEC558E69B9A1E995AA21663395857"},{"bytes":59762,"path":"assets/page-007-xref-21-gen-0-resource-image115.jpg","sha256":"8D4E75A0CD6C3098CFD7B84B4FB603395E7269EC4249B8AB05734751A58EDD70"},{"bytes":77664,"path":"assets/page-008-xref-24-gen-0-resource-image118.jpg","sha256":"456C573FB9955C8A3312CADF47A7559255D3416427B764E874D8D8D7D2B6A35C"},{"bytes":48035,"path":"assets/page-009-xref-80-gen-0-resource-image100.jpg","sha256":"833474CC789C6F5E00034FE72DD8AD95C5C148DD553D5451056A0BE134473525"},{"bytes":117658,"path":"assets/page-011-xref-31-gen-0-resource-image149.jpg","sha256":"BA5B7C947407C8409B5353E7A25196A98BE9E9DC47A786EE0376CD8BC23348B4"},{"bytes":110551,"path":"assets/page-013-xref-36-gen-0-resource-image152.jpg","sha256":"F16BFB5BBC3E13437865969CF46FECB192EDEEAB07978A0E1DABF1C60ED8345B"},{"bytes":163279,"path":"assets/page-014-xref-39-gen-0-resource-image159.jpg","sha256":"5F84FC66111294AF52199ED1C80E48D71F9F8DDB412D52EE2CF42D04E31F7E4D"},{"bytes":65579,"path":"assets/page-015-xref-42-gen-0-resource-image161.jpg","sha256":"9F377A1D675FF226C5405C3A6968540B6A32221C151152C82E7770A708F2B981"},{"bytes":207987,"path":"assets/page-017-xref-47-gen-0-resource-image164.jpg","sha256":"2E39199DC3787B0600AC4F9843FD02DE5F88DFB05BE59ACD833B9A17B5735421"},{"bytes":45533,"path":"assets/page-021-xref-58-gen-0-resource-image171.jpg","sha256":"F21773FEB120405ACF2244939EA196833341DD24A2933AB9F08424AA1E44E5AC"},{"bytes":40846,"path":"assets/page-022-xref-61-gen-0-resource-image174.jpg","sha256":"8CC466F9543AD6EB3BE419B505950EB16CD7B0CF0B3B33CFA0162BFA0F4C97A9"},{"bytes":38341,"path":"assets/page-023-xref-64-gen-0-resource-image177.jpg","sha256":"F51F17C46EF8227AF096809E89EB784E968A715088739DC2B0B7F5778076E743"},{"bytes":36852,"path":"assets/page-024-xref-67-gen-0-resource-image180.jpg","sha256":"6F1393BC7DC691B0B8F2A2039D1C502AEA957D8B8B5617DEB0E1A2A8CD804165"},{"bytes":41174,"path":"assets/page-025-xref-70-gen-0-resource-image183.jpg","sha256":"30F29EF0AFD70573F4F5411B933170A0FAAAFEC268E1842BB6DED414C7AD1F95"},{"bytes":40683,"path":"assets/page-026-xref-73-gen-0-resource-image186.jpg","sha256":"A334E31185E6DCB3C4CA4FF2F900EFFF0F4E77D7CD0C446FD7E4BA0392C35E1A"},{"bytes":3824297,"path":"assets/pdf-page-001-cover.png","sha256":"4517FC7C93E53986C2C286E871D8B59070BED4457041FE0F928A1DC9F9357072"},{"bytes":11987,"path":"effective_visual_config.json","sha256":"56A1988E0F93D41B5C479A23042E922C139F7142298C0C57344F2A50C9730A18"},{"bytes":4336,"path":"INVENTORY.json","sha256":"EFC3B9A1593058FFEEA587D4583EAB66C5DC5799F66D2B52084D704E4915A5AA"},{"bytes":13657,"path":"reader_projection.json","sha256":"B041CA05EBCDEBBB324F3A33DC5908EF819F65D0960EB8FD776ECAF5C1D6E432"}],"inventory_sha256":"13A144C115EEBC4F60899E134E2E3ADC4A216F26D0E1109861DA0B3AA21CB565","root":"outputs/31-artview-apply/artifacts"},"run_identity_sha256":"BB42B89B11E13357F865B4582A5C53AC8F5A3458C3E128F2D16BC39D4E3C25F6","stage_id":"31-artview-apply","stage_name":"artview_apply","stage_version":1,"state":"succeeded","tools":[{"name":"publication_python","scope":"repository_tools","version":"sha256:7958A78EDB29E1BC8B6BB7C1F71271AD824A64F67278903ADA4885104A22A001"},{"name":"pdftoppm","scope":"repository_tools","version":"sha256:575A2F66073B256F69084C4F12F34427E6076B7854B2505CB09ECBDC9957FD7F"},{"name":"libreoffice","scope":"repository_tools","version":"sha256:A2823391857DB1DD8EBBD8234267F9EC58EC7E5B5FC434665C0ECEC4671CB988"}],"upstream":[{"manifest_sha256":"0D4FDF06C69E364C599E7AB7302AFBF632379D10669C7F1135BDAE2F0B15ADFE","stage_id":"10-master-en-candidate"},{"manifest_sha256":"68AF1DF65460AE42B9CF888394B53D32676D33A6D94596E71AE34BFEF0C263F1","stage_id":"20-master-ru-packets"},{"manifest_sha256":"AB89F98A1C85134141C4AAA22C5C5589712DEA95537E26049A25859419AB6878","stage_id":"21-master-ru-candidate"},{"manifest_sha256":"72369E17D369F149D9AEFAE24F9E7A5B5BB5A7AA5F4CF3419B30935DFABA1EFC","stage_id":"30-artview-bundle"}]},"reproducible_sha256":"3D9B079869AA8C36D81B9C2052855F2929637B57BD3291CE4FEAF94F8F161640","schema":"kb_creator.publication_stage_manifest.v1"}
