{"execution":{"completed_at_utc":"2026-09-19T10:37:55.461349Z","exit_code":0,"started_at_utc":"2026-09-19T10:37:51.751828Z","structured_diagnostics":{"independent_verification":{"bytes":1535,"path":"evidence/MASTER_RU.verification.json","sha256":"45926E59E73764A631AF180B107C937D73210289EF78D5A6FFAF983A5940DF75"},"status":"awaiting_master_ru_acceptance","submission":{"bytes":64293,"path":"submissions/master-ru-01/master-ru.submission.json","sha256":"0E3628778F5B3EA9E01BB93DE6F4286299D1276B48DB774525E5FA6383580F40"}}},"reproducible":{"adapter":{"logical_name":"master_ru_assembly_v1","script":{"bytes":129961,"path":"publication_adapters.py","sha256":"C591607EE90943FD8ACAB002A534555740DE9A1ACE888D82720515BB97232144"},"version":1},"cache_key":"7127100458DAF05CCA12ACA83611653DA9471CB7A7CD8F5A390F9136E3DEB70A","effective_config":{"bytes":3444,"path":"effective_publication_config.json","sha256":"38E8DE98D20C80A4C30F9EDB2F1C2D86D52E2B0F248B906732107E3BF58621ED"},"evidence":{"files":[{"bytes":460,"path":"MASTER_RU.qa.json","sha256":"6E2C9959DA9A47FEEB46B180CA2F4274D58D1A72036701C4B2D607366A346105"},{"bytes":1535,"path":"MASTER_RU.verification.json","sha256":"45926E59E73764A631AF180B107C937D73210289EF78D5A6FFAF983A5940DF75"}],"inventory_sha256":"7F2AE9EB0B2E3FFD8FB57F10C1FE5CDA0060ABB39D080FCB9607BC556B2C018A","root":"outputs/21-master-ru-candidate/evidence"},"implementation_inventory_sha256":"AA92C8235C6BF8E8A54B6C943A861CC6EDD3CD0F3D83AF0D8B8751E481220148","inputs":[{"file":{"bytes":5011,"path":"number-7-dream.publication-v11.json","sha256":"A9DCB11CBEDC830063C65E275FCD82761AD03F9D5AFB233C0140600465B6FB37"},"kind":"publication_contract"},{"file":{"bytes":1845,"path":"RECONSTRUCTION_ACCEPTANCE.json","sha256":"E4FF9ED8D3ACC98225FCA973ACA8A90A1B1E53990DA2F8426E2852176A6F184D"},"kind":"accepted_reconstruction"},{"file":{"bytes":64293,"path":"submissions/master-ru-01/master-ru.submission.json","sha256":"0E3628778F5B3EA9E01BB93DE6F4286299D1276B48DB774525E5FA6383580F40"},"kind":"master_ru_submission"}],"outputs":{"files":[{"bytes":4160,"path":"ASSET_MANIFEST.json","sha256":"A12565F3B3EC1BE3047C9E660438275E857E1371C502557ABC27EAA18E3B56AD"},{"bytes":207987,"path":"assets/2e39199dc3787b0600ac4f9843fd02de5f88dfb05be59acd833b9a17b5735421.jpg","sha256":"2E39199DC3787B0600AC4F9843FD02DE5F88DFB05BE59ACD833B9A17B5735421"},{"bytes":41174,"path":"assets/30f29ef0afd70573f4f5411b933170a0faaafec268e1842bb6ded414c7ad1f95.jpg","sha256":"30F29EF0AFD70573F4F5411B933170A0FAAAFEC268E1842BB6DED414C7AD1F95"},{"bytes":77664,"path":"assets/456c573fb9955c8a3312cadf47a7559255d3416427b764e874d8d8d7d2b6a35c.jpg","sha256":"456C573FB9955C8A3312CADF47A7559255D3416427B764E874D8D8D7D2B6A35C"},{"bytes":49023,"path":"assets/55ca597755b7df71c1e3699353265ee4ad9771ebbdb920410317e7073f6284fe.jpg","sha256":"55CA597755B7DF71C1E3699353265EE4AD9771EBBDB920410317E7073F6284FE"},{"bytes":163279,"path":"assets/5f84fc66111294af52199ed1c80e48d71f9f8ddb412d52ee2cf42d04e31f7e4d.jpg","sha256":"5F84FC66111294AF52199ED1C80E48D71F9F8DDB412D52EE2CF42D04E31F7E4D"},{"bytes":36852,"path":"assets/6f1393bc7dc691b0b8f2a2039d1c502aea957d8b8b5617deb0e1a2a8cd804165.jpg","sha256":"6F1393BC7DC691B0B8F2A2039D1C502AEA957D8B8B5617DEB0E1A2A8CD804165"},{"bytes":179661,"path":"assets/7d73dfea3baa03b388a63f836c0ca43f9238efee255ab26ffcdb49bfacf79890.jpg","sha256":"7D73DFEA3BAA03B388A63F836C0CA43F9238EFEE255AB26FFCDB49BFACF79890"},{"bytes":48035,"path":"assets/833474cc789c6f5e00034fe72dd8ad95c5c148dd553d5451056a0be134473525.jpg","sha256":"833474CC789C6F5E00034FE72DD8AD95C5C148DD553D5451056A0BE134473525"},{"bytes":40846,"path":"assets/8cc466f9543ad6eb3be419b505950eb16cd7b0cf0b3b33cfa0162bfa0f4c97a9.jpg","sha256":"8CC466F9543AD6EB3BE419B505950EB16CD7B0CF0B3B33CFA0162BFA0F4C97A9"},{"bytes":59762,"path":"assets/8d4e75a0cd6c3098cfd7b84b4fb603395e7269ec4249b8ab05734751a58edd70.jpg","sha256":"8D4E75A0CD6C3098CFD7B84B4FB603395E7269EC4249B8AB05734751A58EDD70"},{"bytes":49082,"path":"assets/8fc42816bf72beda6938faad5a1aff6dea6de1bef286ee8d8822a8dac55bbbd6.jpg","sha256":"8FC42816BF72BEDA6938FAAD5A1AFF6DEA6DE1BEF286EE8D8822A8DAC55BBBD6"},{"bytes":65579,"path":"assets/9f377a1d675ff226c5405c3a6968540b6a32221c151152c82e7770a708f2b981.jpg","sha256":"9F377A1D675FF226C5405C3A6968540B6A32221C151152C82E7770A708F2B981"},{"bytes":40683,"path":"assets/a334e31185e6dcb3c4ca4ff2f900efff0f4e77d7cd0c446fd7e4ba0392c35e1a.jpg","sha256":"A334E31185E6DCB3C4CA4FF2F900EFFF0F4E77D7CD0C446FD7E4BA0392C35E1A"},{"bytes":117658,"path":"assets/ba5b7c947407c8409b5353e7a25196a98be9e9dc47a786ee0376cd8bc23348b4.jpg","sha256":"BA5B7C947407C8409B5353E7A25196A98BE9E9DC47A786EE0376CD8BC23348B4"},{"bytes":31076,"path":"assets/d546ef251ace98df9136ea8c332883b06594c7082d32ed1ac80c4dbd915d9523.jpg","sha256":"D546EF251ACE98DF9136EA8C332883B06594C7082D32ED1AC80C4DBD915D9523"},{"bytes":110551,"path":"assets/f16bfb5bbc3e13437865969cf46fecb192edeeab07978a0e1dabf1c60ed8345b.jpg","sha256":"F16BFB5BBC3E13437865969CF46FECB192EDEEAB07978A0E1DABF1C60ED8345B"},{"bytes":45533,"path":"assets/f21773feb120405acf2244939ea196833341dd24a2933ab9f08424aa1e44e5ac.jpg","sha256":"F21773FEB120405ACF2244939EA196833341DD24A2933AB9F08424AA1E44E5AC"},{"bytes":38341,"path":"assets/f51f17c46ef8227af096809e89eb784e968a715088739dc2b0b7f5778076e743.jpg","sha256":"F51F17C46EF8227AF096809E89EB784E968A715088739DC2B0B7F5778076E743"},{"bytes":30984,"path":"assets/ffd474f4a049b1968c6f7b5f9068019b5cdec558e69b9a1e995aa21663395857.jpg","sha256":"FFD474F4A049B1968C6F7B5F9068019B5CDEC558E69B9A1E995AA21663395857"},{"bytes":5058,"path":"INVENTORY.json","sha256":"8DC0CAAF818900EEAE6D4FA2D347590C1789C9A264C430C14509186D49A1BC77"},{"bytes":122946,"path":"MASTER_RU.md","sha256":"904133D5057172C404D28F3BCF2A5E4C578304A59382512D1B31FC56AE0FDAB2"},{"bytes":6294,"path":"MASTER_RU.provenance.json","sha256":"7354347FF053366C713884990BCA9B31BD299047E636F35DE6695538AB952090"},{"bytes":460,"path":"MASTER_RU.qa.json","sha256":"6E2C9959DA9A47FEEB46B180CA2F4274D58D1A72036701C4B2D607366A346105"},{"bytes":272618,"path":"TERMINOLOGY.qa.json","sha256":"DA552F16F001B77E08E42AC677FAEEC29034EAC4977716A84FBF6A83D30E85F2"}],"inventory_sha256":"9DA51036925A96C840C2C92EF673FCB2A7807383BBDE810A407D39B19C88E08E","root":"outputs/21-master-ru-candidate/artifacts"},"run_identity_sha256":"BB42B89B11E13357F865B4582A5C53AC8F5A3458C3E128F2D16BC39D4E3C25F6","stage_id":"21-master-ru-candidate","stage_name":"master_ru_candidate","stage_version":1,"state":"succeeded","tools":[{"name":"publication_python","scope":"repository_tools","version":"sha256:7958A78EDB29E1BC8B6BB7C1F71271AD824A64F67278903ADA4885104A22A001"},{"name":"pdftoppm","scope":"repository_tools","version":"sha256:575A2F66073B256F69084C4F12F34427E6076B7854B2505CB09ECBDC9957FD7F"},{"name":"libreoffice","scope":"repository_tools","version":"sha256:A2823391857DB1DD8EBBD8234267F9EC58EC7E5B5FC434665C0ECEC4671CB988"}],"upstream":[{"manifest_sha256":"0D4FDF06C69E364C599E7AB7302AFBF632379D10669C7F1135BDAE2F0B15ADFE","stage_id":"10-master-en-candidate"},{"manifest_sha256":"68AF1DF65460AE42B9CF888394B53D32676D33A6D94596E71AE34BFEF0C263F1","stage_id":"20-master-ru-packets"}]},"reproducible_sha256":"AB89F98A1C85134141C4AAA22C5C5589712DEA95537E26049A25859419AB6878","schema":"kb_creator.publication_stage_manifest.v1"}
