{"execution":{"completed_at_utc":"2026-09-19T10:40:02.303251Z","exit_code":0,"started_at_utc":"2026-09-19T10:39:59.552781Z","structured_diagnostics":{"adapter":"translator_build_production_html_v1","direct_pdf_route":false,"local_reference_count":20,"source_config_sha256":"17CCFF74739CFFC430E7A28846E9D41E3474507BF8A8A1FACC24EAEF8F45E0E9","status":"pass"}},"reproducible":{"adapter":{"logical_name":"translator_build_production_html_v1","script":{"bytes":129961,"path":"publication_adapters.py","sha256":"C591607EE90943FD8ACAB002A534555740DE9A1ACE888D82720515BB97232144"},"version":1},"cache_key":"23737EA9D396E8C33391B3DB27C09006C70D6A90F53D33A5C526C1E325861202","effective_config":{"bytes":3444,"path":"effective_publication_config.json","sha256":"38E8DE98D20C80A4C30F9EDB2F1C2D86D52E2B0F248B906732107E3BF58621ED"},"evidence":{"files":[{"bytes":9911,"path":"derived_html_config.json","sha256":"8D1641DCE871A936B9D2B33BDDC7E029768390F3FC527C31660982E3D6309B81"},{"bytes":123429,"path":"derived_html_source.md","sha256":"9A77B44628EBC990AA2E7ABB796BE0D72D83A936547B3304F98A35C218EA3EA0"},{"bytes":697,"path":"frontmatter_manifest.json","sha256":"B3F26B5608C46A1EED465081E81140E3EC7ADCF79993EC800847F716107EEB07"},{"bytes":14971,"path":"html_adapter_receipt.json","sha256":"0CDFE9635CE964B0FD5C82CAA6A879B0BC88E62345F9F70152A4BE6577AAA603"},{"bytes":7159,"path":"html_semantic_projection.json","sha256":"1F27697FBAD0B014BE7E70D37E060423D4E31F1D4318D53F8B42B70F354A2154"},{"bytes":13451,"path":"production_html_report.json","sha256":"2B7780BEA10DFA0BAB9684EB8E2A1DFD9AB2F6A03CD964D374DEB8B3DF7BEB70"},{"bytes":4250,"path":"source_html_config.json","sha256":"17CCFF74739CFFC430E7A28846E9D41E3474507BF8A8A1FACC24EAEF8F45E0E9"}],"inventory_sha256":"31FF4B387D9C154CFEB1264CD6FABACB4DA032E862AF8B00135F717281FC1823","root":"outputs/40-html-candidate/evidence"},"implementation_inventory_sha256":"AA92C8235C6BF8E8A54B6C943A861CC6EDD3CD0F3D83AF0D8B8751E481220148","inputs":[{"file":{"bytes":5011,"path":"number-7-dream.publication-v11.json","sha256":"A9DCB11CBEDC830063C65E275FCD82761AD03F9D5AFB233C0140600465B6FB37"},"kind":"publication_contract"},{"file":{"bytes":1845,"path":"RECONSTRUCTION_ACCEPTANCE.json","sha256":"E4FF9ED8D3ACC98225FCA973ACA8A90A1B1E53990DA2F8426E2852176A6F184D"},"kind":"accepted_reconstruction"},{"file":{"bytes":1126,"path":"acceptance/master_ru.acceptance.json","sha256":"648307536F72A08463F77964EA501EA44BD3130602D01FC814ABD96B30EAC12D"},"kind":"master_ru_acceptance"},{"file":{"bytes":1090,"path":"acceptance/artview.acceptance.json","sha256":"E91C1F24F8802135BEC425FEB30AB8D8CF778AE82307A59EEEF62B7F6D22B292"},"kind":"artview_acceptance"},{"file":{"bytes":8304,"path":"submissions/artview/artview-decisions.accepted.json","sha256":"BD4EED5B94854FB8909512F1955ECE822CB5F523B990DEF107B90A2BBEF38933"},"kind":"artview_decisions"}],"outputs":{"files":[{"bytes":179661,"path":"assets/master-page-020-asset-001.jpg","sha256":"7D73DFEA3BAA03B388A63F836C0CA43F9238EFEE255AB26FFCDB49BFACF79890"},{"bytes":49023,"path":"assets/page-004-xref-80-gen-0-resource-image100.jpg","sha256":"55CA597755B7DF71C1E3699353265EE4AD9771EBBDB920410317E7073F6284FE"},{"bytes":49082,"path":"assets/page-005-xref-80-gen-0-resource-image100.jpg","sha256":"8FC42816BF72BEDA6938FAAD5A1AFF6DEA6DE1BEF286EE8D8822A8DAC55BBBD6"},{"bytes":31076,"path":"assets/page-006-xref-15-gen-0-resource-image110.jpg","sha256":"D546EF251ACE98DF9136EA8C332883B06594C7082D32ED1AC80C4DBD915D9523"},{"bytes":30984,"path":"assets/page-007-xref-19-gen-0-resource-image112.jpg","sha256":"FFD474F4A049B1968C6F7B5F9068019B5CDEC558E69B9A1E995AA21663395857"},{"bytes":59762,"path":"assets/page-007-xref-21-gen-0-resource-image115.jpg","sha256":"8D4E75A0CD6C3098CFD7B84B4FB603395E7269EC4249B8AB05734751A58EDD70"},{"bytes":77664,"path":"assets/page-008-xref-24-gen-0-resource-image118.jpg","sha256":"456C573FB9955C8A3312CADF47A7559255D3416427B764E874D8D8D7D2B6A35C"},{"bytes":48035,"path":"assets/page-009-xref-80-gen-0-resource-image100.jpg","sha256":"833474CC789C6F5E00034FE72DD8AD95C5C148DD553D5451056A0BE134473525"},{"bytes":117658,"path":"assets/page-011-xref-31-gen-0-resource-image149.jpg","sha256":"BA5B7C947407C8409B5353E7A25196A98BE9E9DC47A786EE0376CD8BC23348B4"},{"bytes":110551,"path":"assets/page-013-xref-36-gen-0-resource-image152.jpg","sha256":"F16BFB5BBC3E13437865969CF46FECB192EDEEAB07978A0E1DABF1C60ED8345B"},{"bytes":163279,"path":"assets/page-014-xref-39-gen-0-resource-image159.jpg","sha256":"5F84FC66111294AF52199ED1C80E48D71F9F8DDB412D52EE2CF42D04E31F7E4D"},{"bytes":65579,"path":"assets/page-015-xref-42-gen-0-resource-image161.jpg","sha256":"9F377A1D675FF226C5405C3A6968540B6A32221C151152C82E7770A708F2B981"},{"bytes":207987,"path":"assets/page-017-xref-47-gen-0-resource-image164.jpg","sha256":"2E39199DC3787B0600AC4F9843FD02DE5F88DFB05BE59ACD833B9A17B5735421"},{"bytes":45533,"path":"assets/page-021-xref-58-gen-0-resource-image171.jpg","sha256":"F21773FEB120405ACF2244939EA196833341DD24A2933AB9F08424AA1E44E5AC"},{"bytes":40846,"path":"assets/page-022-xref-61-gen-0-resource-image174.jpg","sha256":"8CC466F9543AD6EB3BE419B505950EB16CD7B0CF0B3B33CFA0162BFA0F4C97A9"},{"bytes":38341,"path":"assets/page-023-xref-64-gen-0-resource-image177.jpg","sha256":"F51F17C46EF8227AF096809E89EB784E968A715088739DC2B0B7F5778076E743"},{"bytes":36852,"path":"assets/page-024-xref-67-gen-0-resource-image180.jpg","sha256":"6F1393BC7DC691B0B8F2A2039D1C502AEA957D8B8B5617DEB0E1A2A8CD804165"},{"bytes":41174,"path":"assets/page-025-xref-70-gen-0-resource-image183.jpg","sha256":"30F29EF0AFD70573F4F5411B933170A0FAAAFEC268E1842BB6DED414C7AD1F95"},{"bytes":40683,"path":"assets/page-026-xref-73-gen-0-resource-image186.jpg","sha256":"A334E31185E6DCB3C4CA4FF2F900EFFF0F4E77D7CD0C446FD7E4BA0392C35E1A"},{"bytes":3824297,"path":"assets/pdf-page-001-cover.png","sha256":"4517FC7C93E53986C2C286E871D8B59070BED4457041FE0F928A1DC9F9357072"},{"bytes":153683,"path":"Number_7_Dream_RU.html","sha256":"774F22BC2D1FF55BBCEF22ED5BC8539508F265A01D34E7AC8C6E87CE82AB7166"}],"inventory_sha256":"B0C853AC4F6BFF634A4191B39A4DAADBCD415DE4FC271DA693A45F0B9B0C563E","root":"outputs/40-html-candidate/artifacts"},"run_identity_sha256":"BB42B89B11E13357F865B4582A5C53AC8F5A3458C3E128F2D16BC39D4E3C25F6","stage_id":"40-html-candidate","stage_name":"html_candidate","stage_version":1,"state":"succeeded","tools":[{"name":"publication_python","scope":"repository_tools","version":"sha256:7958A78EDB29E1BC8B6BB7C1F71271AD824A64F67278903ADA4885104A22A001"},{"name":"pdftoppm","scope":"repository_tools","version":"sha256:575A2F66073B256F69084C4F12F34427E6076B7854B2505CB09ECBDC9957FD7F"},{"name":"libreoffice","scope":"repository_tools","version":"sha256:A2823391857DB1DD8EBBD8234267F9EC58EC7E5B5FC434665C0ECEC4671CB988"}],"upstream":[{"manifest_sha256":"0D4FDF06C69E364C599E7AB7302AFBF632379D10669C7F1135BDAE2F0B15ADFE","stage_id":"10-master-en-candidate"},{"manifest_sha256":"68AF1DF65460AE42B9CF888394B53D32676D33A6D94596E71AE34BFEF0C263F1","stage_id":"20-master-ru-packets"},{"manifest_sha256":"AB89F98A1C85134141C4AAA22C5C5589712DEA95537E26049A25859419AB6878","stage_id":"21-master-ru-candidate"},{"manifest_sha256":"72369E17D369F149D9AEFAE24F9E7A5B5BB5A7AA5F4CF3419B30935DFABA1EFC","stage_id":"30-artview-bundle"},{"manifest_sha256":"3D9B079869AA8C36D81B9C2052855F2929637B57BD3291CE4FEAF94F8F161640","stage_id":"31-artview-apply"}]},"reproducible_sha256":"1B551FF1AC71E2A046A9E17361D43DD7483297B8A61F215CC46B57F89400EDEC","schema":"kb_creator.publication_stage_manifest.v1"}
