{"execution":{"completed_at_utc":"2026-09-19T10:41:34.692642Z","exit_code":0,"started_at_utc":"2026-09-19T10:40:53.058613Z","structured_diagnostics":{"document_authority_kind":"reviewed_docx","ooxml":"pass","page_count":30,"render_engine":"libreoffice","status":"pass","transient_bridge_cleanup":"pass"}},"reproducible":{"adapter":{"logical_name":"production_docx_reviewed_authority_v2","script":{"bytes":129961,"path":"publication_adapters.py","sha256":"C591607EE90943FD8ACAB002A534555740DE9A1ACE888D82720515BB97232144"},"version":1},"cache_key":"A2AB3C712031CFD9C72D4C6E2D99AD3D8108D1DD6EF5F42A8D4C0DD85DDAC8DA","effective_config":{"bytes":3444,"path":"effective_publication_config.json","sha256":"38E8DE98D20C80A4C30F9EDB2F1C2D86D52E2B0F248B906732107E3BF58621ED"},"evidence":{"files":[{"bytes":689,"path":"docx_build.json","sha256":"95F10368A91524A65B1E1C72A36433CC71EC1F5135D9FD3F3419D83D10114FB2"},{"bytes":809889,"path":"docx_render/page-001.png","sha256":"6AB2638BD9CC7C5E3E6D868E59699472A6E496B7CC3D379724400750B3C2A13E"},{"bytes":75050,"path":"docx_render/page-002.png","sha256":"F62486CA86FC91F7E71F4C253436418F8E81FF7257B177F036BB34E3EBF78D14"},{"bytes":474946,"path":"docx_render/page-003.png","sha256":"CBE5C98AFC5AAE01AF582E2DB1923E9A4AD35B96FF850157CE8C8AA25E33BA0C"},{"bytes":321931,"path":"docx_render/page-004.png","sha256":"4CC103DD807BF7299C34793380243F3657ECF94C70426AED380F932EA09CADC6"},{"bytes":490420,"path":"docx_render/page-005.png","sha256":"92DEF6881567B1B19C9E1B39B3444A20C99067A9744C875B5A14DEB5A8D02377"},{"bytes":274233,"path":"docx_render/page-006.png","sha256":"F563E7B2F7659129994971D2F9D1408250AC1921A52683197F25A2F793E945A4"},{"bytes":619433,"path":"docx_render/page-007.png","sha256":"958DD2EEAC61B41CFE36D0BD658CC9821FB4132DC617C7756D32118956F37177"},{"bytes":254029,"path":"docx_render/page-008.png","sha256":"AB48939FE40D412CE026B2F7CFF7AD3F615DA5680F2963290DE36873559DEBD4"},{"bytes":298695,"path":"docx_render/page-009.png","sha256":"0D7A52CAED4A50D236931AC6F7BB20EBE85BC579C04FA610F72193A88A9F6D71"},{"bytes":447173,"path":"docx_render/page-010.png","sha256":"09CAFE3A40114244168CFE5E79A193FD8D3037BA8A3959A7B8C02F6476F4B807"},{"bytes":271343,"path":"docx_render/page-011.png","sha256":"1EF1949C6285A42ADCDF96AEF6A50D4D9439FB0504A47D4294F4C2A1FF8FA10F"},{"bytes":321231,"path":"docx_render/page-012.png","sha256":"171EF03693CC240EEF4888A60F17575CF56803989E6644B3CED846714572C1F3"},{"bytes":346279,"path":"docx_render/page-013.png","sha256":"AC304DBD4AE1F88BAECCB8206C47EED881ECFD742398DF305F7822CA060BF927"},{"bytes":458716,"path":"docx_render/page-014.png","sha256":"6C7A718592C798265E93B7C225A55A572B90107D78F6A4156F37C4541E333F9C"},{"bytes":313637,"path":"docx_render/page-015.png","sha256":"D619AA361192C3902332C309503B7AD5C7F4AD0AC6E66F501E1378E43D9E7A24"},{"bytes":315048,"path":"docx_render/page-016.png","sha256":"67FA69AF83CA7495E9CA11DD9E78894F0F21167ED83686BE0A31EF85939D47A9"},{"bytes":225449,"path":"docx_render/page-017.png","sha256":"2EBE115C3FF44EADEC6BE83938C2FF36FC20D6722CE266506A986051E22234F7"},{"bytes":297774,"path":"docx_render/page-018.png","sha256":"CB10D11FA0F646E523E35E7689EAE13BC148307436DFEA3A9FFD2A7B3F69B9EE"},{"bytes":262710,"path":"docx_render/page-019.png","sha256":"023B805634FDEB33B8C8C6DD44B7F6363DAD6D13EC9BFBEAAE0FACA35D862E6A"},{"bytes":374463,"path":"docx_render/page-020.png","sha256":"D4BB827AAF414B39C28591B0F2FA3F508392362234CE282B4D2542270683B230"},{"bytes":234259,"path":"docx_render/page-021.png","sha256":"9E23FC5DB9E10B5506FB6133C84276A8EA57BC41A8F2D39B79EF3CDF0F9D32A2"},{"bytes":85885,"path":"docx_render/page-022.png","sha256":"DA53E27C148E0B6C298EEA574FCD303A2BC7F2D3D898F5D6F64827460B863342"},{"bytes":314716,"path":"docx_render/page-023.png","sha256":"D4A087CE3D07017A0A81C06BD96158F5F5C6A6C8D275A3E3A700694D13B19C1D"},{"bytes":177395,"path":"docx_render/page-024.png","sha256":"0D8E0EA39417C0FAC306CA53F1647AA100541F2B468613957F4FDB92686671D7"},{"bytes":243500,"path":"docx_render/page-025.png","sha256":"708F4BF3AE3B679D3E1B0C0E537BB4E1C8BEF258A8A0E089931A4555C8B35588"},{"bytes":206821,"path":"docx_render/page-026.png","sha256":"8A6B2EE772050B34930183B114978CD8131F3A305BCA7A21BF94D2E1F2AD5AF9"},{"bytes":208846,"path":"docx_render/page-027.png","sha256":"7DA42213FF22BF63E7659C0A27C433DE0BD36B521B778AC3259D779E3486626F"},{"bytes":245176,"path":"docx_render/page-028.png","sha256":"A380C5B52A189BD6A7C91C9E486F8A150F035077509675CDFC4A2D42137FF6EE"},{"bytes":212349,"path":"docx_render/page-029.png","sha256":"0C6E3F95F95F925E1D3B5345930817A7C00E8846C2BCAC57F188EAC8FA11234A"},{"bytes":260817,"path":"docx_render/page-030.png","sha256":"8C036E5F2496863482D838F6C960AB0CC1721F322987D5D62545B9E76908A2BB"},{"bytes":8116,"path":"docx_render/render_inventory.json","sha256":"8C62CE97F3E353B7AA51221BCD006A854845BCBAAA4EC1CB15BE6112372D27EB"},{"bytes":5331,"path":"docx_render/review_index.json","sha256":"1DBA9B0D46635F1B9211B0929C92A6D843BC05F100C1940527AB3704821288A4"}],"inventory_sha256":"D965480DDEFD2763D9830BBFC109F31DE55F595F1E48AF4147535DD4B00055E0","root":"outputs/50-docx-candidate/evidence"},"implementation_inventory_sha256":"AA92C8235C6BF8E8A54B6C943A861CC6EDD3CD0F3D83AF0D8B8751E481220148","inputs":[{"file":{"bytes":5011,"path":"number-7-dream.publication-v11.json","sha256":"A9DCB11CBEDC830063C65E275FCD82761AD03F9D5AFB233C0140600465B6FB37"},"kind":"publication_contract"},{"file":{"bytes":1845,"path":"RECONSTRUCTION_ACCEPTANCE.json","sha256":"E4FF9ED8D3ACC98225FCA973ACA8A90A1B1E53990DA2F8426E2852176A6F184D"},"kind":"accepted_reconstruction"},{"file":{"bytes":1144,"path":"acceptance/html.acceptance.json","sha256":"31B8135D4AAF4201871FA92616FFCCEA901563FFD0903E5F766909297649F19C"},"kind":"html_acceptance"},{"file":{"bytes":5350241,"path":"submissions/docx/Number_7_Dream_RU.reviewed.docx","sha256":"16ED29E537C6E87553A5BA4E8CB47725B96C2AE43E5F4ECA3E078716950970D5"},"kind":"reviewed_docx"}],"outputs":{"files":[{"bytes":5350241,"path":"Number_7_Dream_RU.docx","sha256":"16ED29E537C6E87553A5BA4E8CB47725B96C2AE43E5F4ECA3E078716950970D5"}],"inventory_sha256":"937EED082C3A6F3FE1D8660252F6F9E18D30FFBE8C208A82A3C431C5AAC78A77","root":"outputs/50-docx-candidate/artifacts"},"run_identity_sha256":"BB42B89B11E13357F865B4582A5C53AC8F5A3458C3E128F2D16BC39D4E3C25F6","stage_id":"50-docx-candidate","stage_name":"docx_candidate","stage_version":1,"state":"succeeded","tools":[{"name":"publication_python","scope":"repository_tools","version":"sha256:7958A78EDB29E1BC8B6BB7C1F71271AD824A64F67278903ADA4885104A22A001"},{"name":"pdftoppm","scope":"repository_tools","version":"sha256:575A2F66073B256F69084C4F12F34427E6076B7854B2505CB09ECBDC9957FD7F"},{"name":"libreoffice","scope":"repository_tools","version":"sha256:A2823391857DB1DD8EBBD8234267F9EC58EC7E5B5FC434665C0ECEC4671CB988"}],"upstream":[{"manifest_sha256":"0D4FDF06C69E364C599E7AB7302AFBF632379D10669C7F1135BDAE2F0B15ADFE","stage_id":"10-master-en-candidate"},{"manifest_sha256":"68AF1DF65460AE42B9CF888394B53D32676D33A6D94596E71AE34BFEF0C263F1","stage_id":"20-master-ru-packets"},{"manifest_sha256":"AB89F98A1C85134141C4AAA22C5C5589712DEA95537E26049A25859419AB6878","stage_id":"21-master-ru-candidate"},{"manifest_sha256":"72369E17D369F149D9AEFAE24F9E7A5B5BB5A7AA5F4CF3419B30935DFABA1EFC","stage_id":"30-artview-bundle"},{"manifest_sha256":"3D9B079869AA8C36D81B9C2052855F2929637B57BD3291CE4FEAF94F8F161640","stage_id":"31-artview-apply"},{"manifest_sha256":"1B551FF1AC71E2A046A9E17361D43DD7483297B8A61F215CC46B57F89400EDEC","stage_id":"40-html-candidate"}]},"reproducible_sha256":"1452B3C2D9666F7480446D17E99CF1DB519312017F0CCB189FEFD5AD2ECE8A25","schema":"kb_creator.publication_stage_manifest.v1"}
